Cites,Authors,Title,Year,Source,Publisher,ArticleURL,CitesURL,GSRank,QueryDate,Type,DOI,ISSN,CitationURL,Volume,Issue,StartPage,EndPage,ECC,CitesPerYear,CitesPerAuthor,AuthorCount,Age,Abstract
0,"P Spohr, K Dinkla, GW Klau, M El-Kebir","eXamine: Visualizing annotated networks in Cytoscape",2018,"F1000Research","ncbi.nlm.nih.gov","https://www.ncbi.nlm.nih.gov/pmc/articles/PMC6013758.2/","",39,"2020-05-04 02:39:48","HTML","","","",,,,,0,0.00,0,4,2,"Abstract eXamine is a Cytoscape app that displays set membership as contours on top of a node-link layout of a small graph. In addition to facilitating interpretation of enriched gene sets of small biological networks, eXamine can be used in other domains such as the …"
0,"P Sashittal, M El-Kebir","SharpTNI: Counting and Sampling Parsimonious Transmission Networks under a Weak Bottleneck",2019,"bioRxiv","biorxiv.org","https://www.biorxiv.org/content/10.1101/842237v1.abstract","",41,"2020-05-04 02:39:48","","","","",,,,,0,0.00,0,2,1,"Technological advances in genomic sequencing are facilitating the reconstruction of transmission histories during outbreaks in the fight against infectious diseases. However, accurate disease transmission inference using this data is hindered by a number of …"
0,"BJ Raphael, M El-Kebir, G Satas","Phylogeny tree generation from mixed samples",2018,"US Patent App. 15/858,333","Google Patents","https://patents.google.com/patent/US20180285519A1/en","",42,"2020-05-04 02:39:48","","","","",,,,,0,0.00,0,3,2,"Methods and systems for generating character-based phylogeny trees from heritable data from mixture samples are provided. An example method for generating character-based phylogeny trees from heritable data for at least one mixture sample includes the step of …"
0,"P Sashittal, M El-Kebir","TiTUS: Sampling and Summarizing Transmission Trees with Muti-strain Infections",2020,"bioRxiv","biorxiv.org","https://www.biorxiv.org/content/10.1101/2020.03.17.996041v1.abstract","",43,"2020-05-04 02:39:48","","","","",,,,,0,0.00,0,2,1,"The combination of genomic and epidemiological data hold the potential to enable accurate pathogen transmission history inference. However, the inference of outbreak transmission histories remains challenging due to various factors such as within-host pathogen diversity …"
0,"M El-Kebir, N Beerenwinkel, C Boucher…","4.2 Cancer genomics",,"… , and Software For …","drops.dagstuhl.de","https://drops.dagstuhl.de/opus/volltexte/2017/6839/pdf/dagrep_v006_i008_p091_s16351.pdf#page=16","",44,"2020-05-04 02:39:48","PDF","","","",,,,,0,0.00,0,4,,"Cancer is a disease caused by somatic mutations that accrue in a population of cells during the lifetime of an individual [6]. This process can be described by a phylogenetic tree and results in different subpopulations of cells, or clones, each with different complements of …"
0,"G Myers, J Chin, M El-Kebir, AK Emde…","4.7 Visualization Group",,"… , and Software For …","pdfs.semanticscholar.org","https://pdfs.semanticscholar.org/a05b/6937a5f7d6288f3986b6832d38ebfed57712.pdf#page=29","",45,"2020-05-04 02:39:48","PDF","","","",,,,,0,0.00,0,5,,"One observation is that in pan-genomes there are chunks of conserved regions interspersed by highly variable regions. We don't have a good way of visualizing the highly variable region, or interpreting its content in the context of its neighborhood. Some relevant questions …"
0,"M El-Kebir","CS 466–Introduction to Bioinformatics–Lecture 4",2018,"","el-kebir.net","http://www.el-kebir.net/teaching/CS466/lecture14_notes.pdf","",46,"2020-05-04 02:39:48","PDF","","","",,,,,0,0.00,0,1,2,"1.1 Background A protein achieves its biological function through its 3-D structure. The problem of predicting protein structure from an amino acid sequence is a more challenging problem than the prediction of RNA secondary structure that we saw in the last lecture. While …"
0,"M El-Kebir, P Spohr, K Dinkla, GW Klau","eXamine: Visualizing annotated networks in Cytoscape [version 1; referees: 1 approved, 2 approved with reservations]",2018,"F1000Research","experts.illinois.edu","https://experts.illinois.edu/en/publications/examine-visualizing-annotated-networks-in-cytoscape-version-1-ref","",47,"2020-05-04 02:39:48","","","","",,,,,0,0.00,0,4,2,"Abstract eXamine is a Cytoscape app that displays set membership as contours on top of a node-link layout of a small graph. In addition to facilitating interpretation of enriched gene sets of small biological networks, eXamine can be used in other domains such as the …"
0,"K Dinkla, M El-Kebir, CI Bucur, M Siderius…","eXamine: a Cytoscape app for exploring annotated modules in networks",2013,"arXiv preprint arXiv …","arxiv.org","https://arxiv.org/abs/1312.4490","",48,"2020-05-04 02:39:48","","","","",,,,,0,0.00,0,5,7,"Background. Biological networks have growing importance for the interpretation of high-throughput"" omics"" data. Statistical and combinatorial methods allow to obtain mechanistic insights through the extraction of smaller subnetwork modules. Further enrichment analyses …"
0,"FA van der Duyn Schouten, M El-Kebir","Networks, modules and breeding schedules",,"core.ac.uk","","https://core.ac.uk/download/pdf/43409087.pdf","",49,"2020-05-04 02:39:48","PDF","","","",,,,,0,0.00,0,2,,"Technological advances have led to an unprecedented growth of biological data. The main challenge in the post-genomic era is to interpret and make sense out of these data and ultimately answer important biological questions ranging from determining the function and …"
0,"L Weber, N Aguse, N Chia, M El-Kebir","PhyDOSE: Design of Follow-up Single-cell Sequencing Experiments of Tumors",2020,"BioRxiv","biorxiv.org","https://www.biorxiv.org/content/10.1101/2020.03.30.016410v1.abstract","",50,"2020-05-04 02:39:48","","","","",,,,,0,0.00,0,4,1,"The combination of bulk and single-cell DNA sequencing data of the same tumor enables the inference of high-fidelity phylogenies that form the input to many important downstream analyses in cancer genomics. While many studies simultaneously perform bulk and single …"
0,"N Aguse, Y Qi, M El-Kebir","Supplementary Material—Summarizing the Solution Space in Tumor Phylogeny Inference by Multiple Consensus Trees",,"pdfs.semanticscholar.org","","https://pdfs.semanticscholar.org/588c/d9b6a0dca610e9d990d80658a9971fce0def.pdf","",51,"2020-05-04 02:39:48","PDF","","","",,,,,0,0.00,0,3,,"A. 1 Combinatorial Structure and Complexity A. 1.1 Combinatorial Characterization of Optimal Solutions (Main Text) Theorem 1. Given input trees T={T1,..., Tn}, there exists a consensus tree R with minimum distance d (T, R)=∑ ni= 1 d (Ti, R) that is a maximum weight …"
0,"OMC Eddine, CBM El Kébir","NOVEL HYBRID PHOTONIC CRYSTAL FIBER WITH DEFECTED CORE FOR DISPERSION COMPENSATION OVER E TO U BAND TELECOMMUNICATION",2006,"","arpnjournals.org","http://www.arpnjournals.org/jeas/research_papers/rp_2016/jeas_0116_3381.pdf","",52,"2020-05-04 02:39:48","PDF","","","",,,,,0,0.00,0,2,14,"ABSTRACT A Hybrid photonic crystal fiber with defected core is proposed for dispersion compensation over E to U band telecommunication and simulated by finite element method with perfectly matched layers (PML). The numerical results shows a high negative chromatic …"
0,"H Acheson, MEK Field, L Oesper, B Raphael","Reconstructing Clonal Trees From Multi-‐Sample Sequencing Data",,"cs.brown.edu","","http://cs.brown.edu/degrees/undergrad/research/hannah.pdf","",53,"2020-05-04 02:39:48","PDF","","","",,,,,0,0.00,0,4,,"[1] Ding et al. Clonal evolution in relapsed acute myeloid leukaemia revealed by whole-‐genome sequencing. Nature, 481 (7382), 506–10.[2] El Kebir, M., L. Oesper, H. Acheson-‐Field, B. Raphael. Reconstruction of clonal trees and tumor composition from multi-‐sample …"
0,"MEK FEGUIGUI","الحركة الوهابية في كتابات المغاربة-1157. 1367 هـ/1754. 1945 م‎",2015,"","","","",54,"2020-05-04 02:39:48","CITATION","","","",,,,,0,0.00,0,1,5,""
0,"M DEBBAL, M BOUREGAA…","Effect of temperature on dispersion properties in a water-filled photonic crystal fibers",2019,"… on Image and …","ieeexplore.ieee.org","https://ieeexplore.ieee.org/abstract/document/8966845/","",55,"2020-05-04 02:39:48","","","","",,,,,0,0.00,0,3,1,"As flow rates increase, chromatic dispersion becomes a major disadvantage in long distance links. In this paper, we present simulation results using the beam propagating method (BPM) of a hexagonal microstructured fiber infiltrated with water designed for …"
0,"M Debbal, M Bouregaa, H Chikh-Bled…","Influence of Temperature on the Chromatic Dispersion of Photonic Crystal Fiber by Infiltrating the Air Holes with Water",2019,"Journal of Optical …","degruyter.com","https://www.degruyter.com/view/journals/joc/ahead-of-print/article-10.1515-joc-2019-0074/article-10.1515-joc-2019-0074.xml","",56,"2020-05-04 02:39:48","","","","",,,,,0,0.00,0,4,1,"This paper describes study of photonic crystal fiber (PCF) in order to study the influence of temperature on the chromatic dispersion; these types of fibers are based on commercial structures, but air holes will be infiltrated with water. Using finite domain-beam propagation …"
0,"H Chikh-Bled, B Lasri…","CHARACTERISTICS OF DUAL-CORE PHOTONIC CRYSTAL FIBER BY FD-BPM",2015,"Journal of …","Journal of Theoretical and Applied …","","",57,"2020-05-04 02:39:48","CITATION","","","",,,,,0,0.00,0,3,5,""
0,"MCE OUADAH, MEK CHIKH-BLED","Fibre microstructurée à grande dispersion négative accordable dans la bande C",,"Revue Méditerranéenne des …","revues.imist.ma","https://revues.imist.ma/index.php?journal=RMT&page=article&op=download&path%5B%5D=3092&path%5B%5D=2218","",59,"2020-05-04 02:39:48","PDF","","","",,,,,0,0.00,0,2,,"Avec l'augmentation des débits, la dispersion chromatique devient un inconvénient majeur dans les liaisons longues distances. L'apparition des fibres à Cristal photonique donne de nouvelles opportunités pour la réalisation de fibres avec des capillaires remplis avec un …"
